,oid,Id,sentence,Flag,context,party,year,incumbent,labels
0,0,63620_198010_0,Five years ago we committed Australia to a new sense of direction and national purpose,1,,Liberal,1980,Liberal,1
1,1,63620_198010_1,We have fulfilled that commitment.,1,Five years ago we committed Australia to a new sense of direction and national purpose,Liberal,1980,Liberal,1
2,2,63620_198010_2,Five years ago we pledged ourselves to recharge the nation's capacity.,1,Five years ago we committed Australia to a new sense of direction and national purpose We have fulfilled that commitment.,Liberal,1980,Liberal,1
3,3,63620_198010_3,We have fulfilled that pledge.,1,We have fulfilled that commitment. Five years ago we pledged ourselves to recharge the nation's capacity.,Liberal,1980,Liberal,1
4,4,63620_198010_4,And let us never forget that five years ago the confidence and optimism of Australians had been shattered.,1,Five years ago we pledged ourselves to recharge the nation's capacity. We have fulfilled that pledge.,Liberal,1980,Liberal,1
5,5,63620_198010_5,"Today, a new spirit, a new enthusiasm, a new dynamism, is at work in Australia.",1,We have fulfilled that pledge. And let us never forget that five years ago the confidence and optimism of Australians had been shattered.,Liberal,1980,Liberal,1
6,6,63620_198010_6,"In an often troubled and dangerous world, here we are at the gateway of a new decade much better placed than many overseas countries.",1,"And let us never forget that five years ago the confidence and optimism of Australians had been shattered. Today, a new spirit, a new enthusiasm, a new dynamism, is at work in Australia.",Liberal,1980,Liberal,1
7,7,63620_198010_7,- A new confidence is alive in Australia's men and women.,1,"Today, a new spirit, a new enthusiasm, a new dynamism, is at work in Australia. In an often troubled and dangerous world, here we are at the gateway of a new decade much better placed than many overseas countries.",Liberal,1980,Liberal,1
8,8,63620_198010_8,- Our financial position is the envy of many industrialised countries.,1,"In an often troubled and dangerous world, here we are at the gateway of a new decade much better placed than many overseas countries. - A new confidence is alive in Australia's men and women.",Liberal,1980,Liberal,1
9,9,63620_198010_9,- Business expectations are high.,1,- A new confidence is alive in Australia's men and women. - Our financial position is the envy of many industrialised countries.,Liberal,1980,Liberal,1
10,10,63620_198010_10,- the optimism of overseas investors has been restored.,1,- Our financial position is the envy of many industrialised countries. - Business expectations are high.,Liberal,1980,Liberal,1
11,11,63620_198010_11,- Manufacturing exports are growing strongly.,1,- Business expectations are high. - the optimism of overseas investors has been restored.,Liberal,1980,Liberal,1
12,12,63620_198010_12,- Last year rural exports were the highest for the decade.,1,- the optimism of overseas investors has been restored. - Manufacturing exports are growing strongly.,Liberal,1980,Liberal,1
13,13,63620_198010_13,"- Last year, Our balance of trade was the best result for the decade.",1,- Manufacturing exports are growing strongly. - Last year rural exports were the highest for the decade.,Liberal,1980,Liberal,1
14,14,63620_198010_14,- This year we achieved the best employment growth for ten years.,1,"- Last year rural exports were the highest for the decade. - Last year, Our balance of trade was the best result for the decade.",Liberal,1980,Liberal,1
15,15,63620_198010_15,"- And under the Fraser-Anthony Government, Australia has won A respected place in world affairs.",1,"- Last year, Our balance of trade was the best result for the decade. - This year we achieved the best employment growth for ten years.",Liberal,1980,Liberal,1
16,16,63620_198010_16,"And while achieving all this, we have enhanced the dignity and self-esteem of those in need.",1,"- This year we achieved the best employment growth for ten years. - And under the Fraser-Anthony Government, Australia has won A respected place in world affairs.",Liberal,1980,Liberal,1
17,17,63620_198010_17,Australia is the best place in the world to bring up a family.,1,"- And under the Fraser-Anthony Government, Australia has won A respected place in world affairs. And while achieving all This, we have enhanced the dignity And self-esteem of those in need.",Liberal,1980,Liberal,1
18,18,63620_198010_18,And we are going to keep it that way.,1,"And while achieving all this, we have enhanced the dignity and self-esteem of those in need. Australia is the best place in the world to bring up a family.",Liberal,1980,Liberal,1
19,19,63620_198010_19,But what has taken us five years to build can easily be destroyed.,1,Australia is the best place in the world to bring up a family. And we are going to keep it that way.,Liberal,1980,Liberal,1
20,20,63620_198010_20,Do we want our dreams of the future to be turned into another Labor nightmare?,1,And we are going to keep it that way. But what has taken us five years to build can easily be destroyed.,Liberal,1980,Liberal,1
21,21,63620_198010_21,Can we trust our hard-won victories to the Labor Party?,1,But what has taken us five years to build can easily be destroyed. Do we want our dreams of the future to be turned into another Labor nightmare?,Liberal,1980,Liberal,1
22,22,63620_198010_22,CHALLENGES.,1,Do we want our dreams of the future to be turned into another Labor nightmare? Can we trust our hard-won victories to the Labor Party?,Liberal,1980,Liberal,1
23,23,63620_198010_23,"Tonight, I want to talk to you about the challenges and opportunities that lie before us.",1,Can we trust our hard-won victories to the Labor Party? CHALLENGES.,Liberal,1980,Liberal,1
24,24,63620_198010_24,"First, we must maintain responsibility in economic affairs because, without that, all else fails.",0,"CHALLENGES. Tonight, I want to talk to you about the challenges and opportunities that lie before us.",Liberal,1980,Liberal,1
25,25,63620_198010_25,"Second, we must harness this nation's resources in a co-ordinated and responsible programme of national development.",0,"Tonight, I want to talk to you about the challenges and opportunities that lie before us. First, we must maintain responsibility in economic affairs because, without that, all else fails.",Liberal,1980,Liberal,1
26,26,63620_198010_26,"Third, we must see that from the prosperity we generate, we provide adequately for those in need.",0,"First, we must maintain responsibility in economic affairs because, without that, all else fails. Second, we must harness this nation's resources in a co-ordinated and responsible programme of national development.",Liberal,1980,Liberal,1
27,27,63620_198010_27,"Fourth, as individuals and as a nation, we must encourage ability and cultivate excellence.",0,"Second, we must harness this nation's resources in a co-ordinated and responsible programme of national development. Third, we must see that from the prosperity we generate, we provide adequately for those in need.",Liberal,1980,Liberal,1
28,28,63620_198010_28,"And finally, in a world where there is conflict, division and illusion, we must guide Australia safely through the difficulties and the dangers.",0,"Third, we must see that from the prosperity we generate, we provide adequately for those in need. Fourth, as individuals and as a nation, we must encourage ability and cultivate excellence.",Liberal,1980,Liberal,1
29,29,63620_198010_29,FIRST CHALLENGE: RESPONSIBLE ECONOMIC MANAGEMENT.,1,"Fourth, as individuals and as a nation, we must encourage ability and cultivate excellence. And finally, in a world where there is conflict, division and illusion, we must guide Australia safely through the difficulties and the dangers.",Liberal,1980,Liberal,1
30,30,63620_198010_30,The first challenge facing Government in the 80s is the pursuit of responsible economic management.,1,"And finally, in a world where there is conflict, division and illusion, we must guide Australia safely through the difficulties and the dangers. FIRST CHALLENGE: RESPONSIBLE ECONOMIC MANAGEMENT.",Liberal,1980,Liberal,1
31,31,63620_198010_31,Responsible economic management may sometimes sound far-away from our everyday lives.,1,FIRST CHALLENGE: RESPONSIBLE ECONOMIC MANAGEMENT. The first challenge facing Government in the 80s is the pursuit of responsible economic management.,Liberal,1980,Liberal,1
32,32,63620_198010_32,But responsible economic management has brought our inflation rate to: - much less than it was in 1975.,1,The first challenge facing Government in the 80s is the pursuit of responsible economic management. Responsible economic management may sometimes sound far-away from our everyday lives.,Liberal,1980,Liberal,1
33,33,63620_198010_33,- much less than the inflation rate of Britain.,1,Responsible economic management may sometimes sound far-away from our everyday lives. But responsible economic management has brought our inflation rate to: - much less than it was in 1975.,Liberal,1980,Liberal,1
34,34,63620_198010_34,- below that of the United States.,1,But responsible economic management has brought our inflation rate to: - much less than it was in 1975. - much less than the inflation rate of Britain.,Liberal,1980,Liberal,1
35,35,63620_198010_35,- And below the average of advanced industrialised countries.,1,- much less than the inflation rate of Britain. - below that of the United States.,Liberal,1980,Liberal,1
36,36,63620_198010_36,But there is more to be done.,1,- below that of the United States. - And below the average of advanced industrialised countries.,Liberal,1980,Liberal,1
37,37,63620_198010_37,Continued economic responsibility demands restraint in Government expenditure.,1,- And below the average of advanced industrialised countries. But there is more to be done.,Liberal,1980,Liberal,1
38,38,63620_198010_38,"And last year, we achieved the largest ever recorded reduction in the Budget deficit - $1.5 billion.",1,But there is more to be done. Continued economic responsibility demands restraint in Government expenditure.,Liberal,1980,Liberal,1
39,39,63620_198010_39,"And now, this financial year, the domestic deficit will be wiped out altogether.",1,"Continued economic responsibility demands restraint in Government expenditure. And last year, we achieved the largest ever recorded reduction in the Budget deficit - $1.5 billion.",Liberal,1980,Liberal,1
40,40,63620_198010_40,TAXATION.,1,"And last year, we achieved the largest ever recorded reduction in the Budget deficit - $1.5 billion. And now, this financial year, the domestic deficit will be wiped out altogether.",Liberal,1980,Liberal,1
41,41,63620_198010_41,We earlier committed ourselves to reform the tax scales.,1,"And now, this financial year, the domestic deficit will be wiped out altogether. TAXATION.",Liberal,1980,Liberal,1
42,42,63620_198010_42,We have fulfilled that commitment absolutely.,1,TAXATION. We earlier committed ourselves to reform the tax scales.,Liberal,1980,Liberal,1
43,43,63620_198010_43,"Under the Hayden/Labor scales: - from $7.000, you paid 35 cents in the dollar.",1,We earlier committed ourselves to reform the tax scales. We have fulfilled that commitment absolutely.,Liberal,1980,Liberal,1
44,44,63620_198010_44,"- from $10,000 you paid 45 cents in the dollar.",1,"We have fulfilled that commitment absolutely. Under the Hayden/Labor scales: - from $7.000, you paid 35 cents in the dollar.",Liberal,1980,Liberal,1
45,45,63620_198010_45,"- from $15,000 you paid 55 cents in the dollar.",1,"Under the Hayden/Labor scales: - from $7.000, you paid 35 cents in the dollar. - from $10,000 you paid 45 cents in the dollar.",Liberal,1980,Liberal,1
46,46,63620_198010_46,"Under our scales, you are on the standard rate of 32 cents in the dollar, right up to $17.239.",1,"- from $10,000 you paid 45 cents in the dollar. - from $15,000 you paid 55 cents in the dollar.",Liberal,1980,Liberal,1
47,47,63620_198010_47,"And on the first of July this year, taxes were cut by over $600 million - of particular benefit to single income families.",1,"- from $15,000 you paid 55 cents in the dollar. Under our scales, you are on the standard rate of 32 cents in the dollar, right up to $17.239.",Liberal,1980,Liberal,1
48,48,63620_198010_48,Under our present policy of half tax indexation there will be a further tax cut of around $ 500 million from July the first next year.,0,"Under our scales, you are on the standard rate of 32 cents in the dollar, right up to $17.239. And on the first of July this year, taxes were cut by over $600 million - of particular benefit to single income families.",Liberal,1980,Liberal,7
49,49,63620_198010_49,"Of course, we would have preferred to go further.",0,"And on the first of July this year, taxes were cut by over $600 million - of particular benefit to single income families. Under our present policy of half tax indexation there will be a further tax cut of around $ 500 million from July the first next year.",Liberal,1980,Liberal,1
50,50,63620_198010_50,But any tax cut purchased at the cost of higher inflation would be no tax cut at all And we will continue to fight inflation.,0,"Under our present policy of half tax indexation there will be a further tax cut of around $ 500 million from July the first next year. Of course, we would have preferred to go further.",Liberal,1980,Liberal,1
51,51,63620_198010_51,"No wonder British investors recently said that their confidence in the Australian economy was ""Conditional upon the continuation of a Liberal Government.""",1,"Of course, we would have preferred to go further. But any tax cut purchased at the cost of higher inflation would be no tax cut at all And we will continue to fight inflation.",Liberal,1980,Liberal,1
52,52,63620_198010_52,And we plan to keep it that way.,1,"But any tax cut purchased at the cost of higher inflation would be no tax cut at all And we will continue to fight inflation. No wonder British investors recently said that their confidence in the Australian economy was ""Conditional upon the continuation of a Liberal Government.""",Liberal,1980,Liberal,1
53,53,63620_198010_53,SECOND CHALLENGE: DEVELOPMENT.,1,"No wonder British investors recently said that their confidence in the Australian economy was ""Conditional upon the continuation of a Liberal Government."" And we plan to keep it that way.",Liberal,1980,Liberal,1
54,54,63620_198010_54,And so I come to the second challenge - the need for a broad based and responsible programme of national development.,1,And we plan to keep it that way. SECOND CHALLENGE: DEVELOPMENT.,Liberal,1980,Liberal,1
55,55,63620_198010_55,"In my Policy Speech in 1977, I said Australia could look forward to $6000 million of development.",1,SECOND CHALLENGE: DEVELOPMENT. And so I come to the second challenge - the need for a broad based and responsible programme of national development.,Liberal,1980,Liberal,1
56,56,63620_198010_56,Some amazement was expressed at this even disbelief.,1,"And so I come to the second challenge - the need for a broad based and responsible programme of national development. In my Policy Speech in 1977, I said Australia could look forward to $6000 million of development.",Liberal,1980,Liberal,1
57,57,63620_198010_57,Because the Labor Party had stopped development dead in its tracks,1,"In my Policy Speech in 1977, I said Australia could look forward to $6000 million of development. Some amazement was expressed at this even disbelief.",Liberal,1980,Liberal,1
58,58,63620_198010_58,"Yet in the two years after that, more than $6000 million was invested in mining and manufacturing.",1,Some amazement was expressed at this even disbelief. Because the Labor Party had stopped development dead in its tracks,Liberal,1980,Liberal,1
59,59,63620_198010_59,"And now, prospective investment is $29000 million.",0,"Because the Labor Party had stopped development dead in its tracks Yet in the two years after that, more than $6000 million was invested in mining and manufacturing.",Liberal,1980,Liberal,5
60,60,63620_198010_60,This development promises to be as important to Australia and individual Australians as anything in the last 35 years.,1,"Yet in the two years after that, more than $6000 million was invested in mining and manufacturing. And now, prospective investment is $29000 million.",Liberal,1980,Liberal,1
61,61,63620_198010_61,"Already, new aluminium smelters and mines are being established in Australia along with the associated new towns, railways, roads and port facilities.",1,"And now, prospective investment is $29000 million. This development promises to be as important to Australia and individual Australians as anything in the last 35 years.",Liberal,1980,Liberal,1
62,62,63620_198010_62,The benefits of this will be felt nation-wide.,1,"This development promises to be as important to Australia and individual Australians as anything in the last 35 years. Already, new aluminium smelters and mines are being established in Australia along with the associated new towns, railways, roads and port facilities.",Liberal,1980,Liberal,1
63,63,63620_198010_63,We are not talking about development just for development's sake.,1,"Already, new aluminium smelters and mines are being established in Australia along with the associated new towns, railways, roads and port facilities. The benefits of this will be felt nation-wide.",Liberal,1980,Liberal,1
64,64,63620_198010_64,"We are talking about development because of what it means to people: - and it means jobs, prosperity and security for Australian working men and women.",1,The benefits of this will be felt nation-wide. We are not talking about development just for development's sake.,Liberal,1980,Liberal,1
65,65,63620_198010_65,"To achieve all this, we have had to trim our sails once or twice.",1,"We are not talking about development just for development's sake. We are talking about development because of what it means to people: - and it means jobs, prosperity and security for Australian working men and women.",Liberal,1980,Liberal,1
66,66,63620_198010_66,For the world is a harsher place than anyone expected five years ago.,1,"We are talking about development because of what it means to people: - and it means jobs, prosperity and security for Australian working men and women. To achieve all this, we have had to trim our sails once or twice.",Liberal,1980,Liberal,1
67,67,63620_198010_67,"But responsible management means placing Australia first; not once, or twice, but always.",0,"To achieve all this, we have had to trim our sails once or twice. For the world is a harsher place than anyone expected five years ago.",Liberal,1980,Liberal,1
68,68,63620_198010_68,UNIONS.,1,"For the world is a harsher place than anyone expected five years ago. But responsible management means placing Australia first; not once, or twice, but always.",Liberal,1980,Liberal,1
69,69,63620_198010_69,"Placing Australia first is the responsibility of management, labour and trade unions just as much as it is of Government.",0,"But responsible management means placing Australia first; not once, or twice, but always. UNIONS.",Liberal,1980,Liberal,3
70,70,63620_198010_70,"Responsibility to Australia means: - achieving greater rank and file influence within unions and - giving rank and file trade unionists, confronted with the demand to join a strike, the option of a secret ballot.",0,"UNIONS. Placing Australia first is the responsibility of management, labour and trade unions just as much as it is of Government.",Liberal,1980,Liberal,1
71,71,63620_198010_71,"But, above all, it means: - rejection of 35 hour weeks.",0,"Placing Australia first is the responsibility of management, labour and trade unions just as much as it is of Government. Responsibility to Australia means: - achieving greater rank and file influence within unions and - giving rank and file trade unionists, confronted with the demand to join a strike, the option of a secret ballot.",Liberal,1980,Liberal,1
72,72,63620_198010_72,"- rejection of unrealistic wage claims, And - rejection of extremist union leaders.",0,"Responsibility to Australia means: - achieving greater rank and file influence within unions and - giving rank and file trade unionists, confronted with the demand to join a strike, the option of a secret ballot. But, above all, it means: - rejection of 35 hour weeks.",Liberal,1980,Liberal,1
73,73,63620_198010_73,And that rejection is the duty of us all.,0,"But, above all, it means: - rejection of 35 hour weeks. - rejection of unrealistic wage claims, And - rejection of extremist union leaders.",Liberal,1980,Liberal,1
74,74,63620_198010_74,Let me give you another measure of what is happening in Australia.,1,"- rejection of unrealistic wage claims, And - rejection of extremist union leaders. And that rejection is the duty of us all.",Liberal,1980,Liberal,1
75,75,63620_198010_75,The increase in electricity generation through the 80s will be almost equal to that which occurred over the last thirty years.,1,And that rejection is the duty of us all. Let me give you another measure of what is happening in Australia.,Liberal,1980,Liberal,1
76,76,63620_198010_76,We are going to do in ten years what previous generations took thirty years to accomplish.,0,Let me give you another measure of what is happening in Australia. The increase in electricity generation through the 80s will be almost equal to that which occurred over the last thirty years.,Liberal,1980,Liberal,3
77,77,63620_198010_77,Modern new industries are coming on stream with modern plant and equipment involving the most advanced technology.,1,The increase in electricity generation through the 80s will be almost equal to that which occurred over the last thirty years. We are going to do in ten years what previous generations took thirty years to accomplish.,Liberal,1980,Liberal,1
78,78,63620_198010_78,These new developments will give Australia in the 80s a much stronger international base.,0,We are going to do in ten years what previous generations took thirty years to accomplish. Modern new industries are coming on stream with modern plant and equipment involving the most advanced technology.,Liberal,1980,Liberal,6
79,79,63620_198010_79,New markets are opening up for Australian industries.,1,Modern new industries are coming on stream with modern plant and equipment involving the most advanced technology. These new developments will give Australia in the 80s a much stronger international base.,Liberal,1980,Liberal,1
80,80,63620_198010_80,None of this has happened by accident.,1,These new developments will give Australia in the 80s a much stronger international base. New markets are opening up for Australian industries.,Liberal,1980,Liberal,1
81,81,63620_198010_81,We have introduced: - firm anti-inflationary policies.,1,New markets are opening up for Australian industries. None of this has happened by accident.,Liberal,1980,Liberal,1
82,82,63620_198010_82,- policies which encourage And support new Australian initiatives.,1,None of this has happened by accident. We have introduced: - firm anti-inflationary policies.,Liberal,1980,Liberal,1
83,83,63620_198010_83,"- policies which reflect A responsible And reasonable attitude to overseas investment, And - policies which protect the Australian environment.",1,We have introduced: - firm anti-inflationary policies. - policies which encourage And support new Australian initiatives.,Liberal,1980,Liberal,1
84,84,63620_198010_84,What is happening is the result of our policies.,1,"- policies which encourage And support new Australian initiatives. - policies which reflect A responsible And reasonable attitude to overseas investment, And - policies which protect the Australian environment.",Liberal,1980,Liberal,1
85,85,63620_198010_85,PARITY PRICING.,1,"- policies which reflect A responsible And reasonable attitude to overseas investment, And - policies which protect the Australian environment. What is happening is the result of Our policies.",Liberal,1980,Liberal,1
86,86,63620_198010_86,And our oil parity pricing policy is an important part of the overall plan.,1,What is happening is the result of our policies. PARITY PRICING.,Liberal,1980,Liberal,1
87,87,63620_198010_87,We want Australia to be as energy self-sufficient as possible in future years.,0,PARITY PRICING. And our oil parity pricing policy is an important part of the overall plan.,Liberal,1980,Liberal,3
88,88,63620_198010_88,We do not want Australia to be a beggar for fuel on the international market.,0,And our oil parity pricing policy is an important part of the overall plan. We want Australia to be as energy self-sufficient as possible in future years.,Liberal,1980,Liberal,1
89,89,63620_198010_89,We want to attract investment in alternatives to oil.,0,We want Australia to be as energy self-sufficient as possible in future years. We do not want Australia to be a beggar for fuel on the international market.,Liberal,1980,Liberal,1
90,90,63620_198010_90,And we are succeeding.,0,We do not want Australia to be a beggar for fuel on the international market. We want to attract investment in alternatives to oil.,Liberal,1980,Liberal,1
91,91,63620_198010_91,"The giant Rundle shale oil project in Queensland is likely to be the largest ever undertaken in Australia, and one of the largest in the world.",1,We want to attract investment in alternatives to oil. And we are succeeding.,Liberal,1980,Liberal,1
92,92,63620_198010_92,That would not have occurred without parity pricing.,1,"And we are succeeding. The giant Rundle shale oil project in Queensland is likely to be the largest ever undertaken in Australia, and one of the largest in the world.",Liberal,1980,Liberal,1
