,oid,Id,sentence,Flag,context,party,year,incumbent,labels
506,506,63620_198010_506,Under our present policy of half tax indexation there will be a further tax cut of around $500 million from 1 July next year.,1,"The first $4,041 is tax free-$6,542 for a man with a dependent wife. Tax indexation at 50% and the increase in a wife's allowance from 1 July this year means that a wage earner on standard rate with dependent wife now pays $4.76 a week less tax.",Liberal,1980,Liberal,1
507,507,63620_198010_507,The top marginal tax rate has been reduced from 65c in the dollar to 60c.,1,Tax indexation at 50% and the increase in a wife's allowance from 1 July this year means that a wage earner on standard rate with dependent wife now pays $4.76 a week less tax. Under our present policy of half tax indexation there will be a further tax cut of around $500 million from 1 July next year.,Liberal,1980,Liberal,1
508,508,63620_198010_508,This is the lowest top rate since 1942.,1,Under our present policy of half tax indexation there will be a further tax cut of around $500 million from 1 July next year. The top marginal tax rate has been reduced from 65c in the dollar to 60c.,Liberal,1980,Liberal,1
509,509,63620_198010_509,"By reducing the number of steps in the tax rate scale from 7 to 3, taxpayers no longer move into higher tax brackets as quickly as before.",1,The top marginal tax rate has been reduced from 65c in the dollar to 60c. This is the lowest top rate since 1942.,Liberal,1980,Liberal,1
510,510,63620_198010_510,"Hard work, overtime and promotion are worthwhile once again.",1,"This is the lowest top rate since 1942. By reducing the number of steps in the tax rate scale from 7 to 3, taxpayers no longer move into higher tax brackets as quickly as before.",Liberal,1980,Liberal,1
511,511,63620_198010_511,We have restored the rewards for enterprise and achievement.,1,"By reducing the number of steps in the tax rate scale from 7 to 3, taxpayers no longer move into higher tax brackets as quickly as before. Hard work, overtime and promotion are worthwhile once again.",Liberal,1980,Liberal,1
512,512,63620_198010_512,We have also made adjustments in the tax system to strengthen our commitment to the family and those with special needs: - we have doubled the dependent wife's allowance to $800.,0,"Hard work, overtime and promotion are worthwhile once again. We have restored the rewards for enterprise and achievement.",Liberal,1980,Liberal,7
513,513,63620_198010_513,- we have increased the sole-parent's rebate by 180 % to $559.,0,We have restored the rewards for enterprise and achievement. We have also made adjustments in the tax system to strengthen our commitment to the family and those with special needs: - we have doubled the dependent wife's allowance to $800.,Liberal,1980,Liberal,1
514,514,63620_198010_514,"- we have helped lower income earners by increasing the tax free threshold from - $2,579 in 1975/76 to $4,041.",0,We have also made adjustments in the tax system to strengthen our commitment to the family and those with special needs: - we have doubled the dependent wife's allowance to $800. - we have increased the sole-parent's rebate by 180 % to $559.,Liberal,1980,Liberal,3
515,515,63620_198010_515,- we have introduced A special tax concession for self employed persons And those not covered by employer superannuation to assist them in providing for retirement.,0,"- we have increased the sole-parent's rebate by 180 % to $559. - we have helped lower income earners by increasing the tax free threshold from - $2,579 in 1975/76 to $4,041.",Liberal,1980,Liberal,6
516,516,63620_198010_516,- we have announced an inquiry into zone allowances for those living in remote areas.,0,"- we have helped lower income earners by increasing the tax free threshold from - $2,579 in 1975/76 to $4,041. - we have introduced A special tax concession for self employed persons And those not covered by employer superannuation to assist them in providing for retirement.",Liberal,1980,Liberal,1
517,517,63620_198010_517,- we have abolished all Commonwealth estate And gift duties.,0,- we have introduced A special tax concession for self employed persons And those not covered by employer superannuation to assist them in providing for retirement. - we have announced an inquiry into zone allowances for those living in remote areas.,Liberal,1980,Liberal,6
518,518,63620_198010_518,The contrast with Labor's period of office is dramatic.,1,- we have announced an inquiry into zone allowances for those living in remote areas. - we have abolished all Commonwealth estate And gift duties.,Liberal,1980,Liberal,1
519,519,63620_198010_519,In those three years personal tax collections rose by 125% as men and women from all walks of life were dragged into paying higher taxes.,1,- we have abolished all Commonwealth estate And gift duties. The contrast with Labor's period of office is dramatic.,Liberal,1980,Liberal,1
520,520,63620_198010_520,"If Labor's 1975 tax scales had remained, a taxpayer on average weekly earnings today with a dependent wife and child would be paying an extra $22.55 a week more tax.",1,The contrast with Labor's period of office is dramatic. In those three years personal tax collections rose by 125% as men and women from all walks of life were dragged into paying higher taxes.,Liberal,1980,Liberal,1
521,521,63620_198010_521,Business.,1,"In those three years personal tax collections rose by 125% as men and women from all walks of life were dragged into paying higher taxes. If Labor's 1975 tax scales had remained, a taxpayer on average weekly earnings today with a dependent wife and child would be paying an extra $22.55 a week more tax.",Liberal,1980,Liberal,1
522,522,63620_198010_522,We believe fair rewards for business are just as important as fair rewards for people.,0,"If Labor's 1975 tax scales had remained, a taxpayer on average weekly earnings today with a dependent wife and child would be paying an extra $22.55 a week more tax. Business.",Liberal,1980,Liberal,1
523,523,63620_198010_523,"Only a healthy, profitable private sector can provide real, lasting, secure jobs.",1,Business. We believe fair rewards for business are just as important as fair rewards for people.,Liberal,1980,Liberal,1
524,524,63620_198010_524,Concessions to our primary and secondary industries have been designed to foster profitability and reinvestment of profits.,0,"We believe fair rewards for business are just as important as fair rewards for people. Only a healthy, profitable private sector can provide real, lasting, secure jobs.",Liberal,1980,Liberal,1
525,525,63620_198010_525,"We have, amongst other measures - reintroduced the investment allowance.",0,"Only a healthy, profitable private sector can provide real, lasting, secure jobs. Concessions to our primary and secondary industries have been designed to foster profitability and reinvestment of profits.",Liberal,1980,Liberal,1
526,526,63620_198010_526,- allowed accelerated depreciation to assist Business with technological change.,0,"Concessions to our primary and secondary industries have been designed to foster profitability and reinvestment of profits. We have, amongst other measures - reintroduced the investment allowance.",Liberal,1980,Liberal,1
527,527,63620_198010_527,"- raised the Private Company Retention Allowance from 50 % to 70 %, which is a benefit of $60 million in a full year.",0,"We have, amongst other measures - reintroduced the investment allowance. - allowed accelerated depreciation to assist Business with technological change.",Liberal,1980,Liberal,7
528,528,63620_198010_528,- introduced income equalisation deposits for Primary producers.,0,"- allowed accelerated depreciation to assist Business with technological change. - raised the Private Company Retention Allowance from 50 % to 70 %, which is a benefit of $60 million in a full year.",Liberal,1980,Liberal,1
529,529,63620_198010_529,- abolished previous income limits on the tax averaging Scheme for Primary producers.,0,"- raised the Private Company Retention Allowance from 50 % to 70 %, which is a benefit of $60 million in a full year. - introduced income equalisation deposits for Primary producers.",Liberal,1980,Liberal,6
530,530,63620_198010_530,"- stimulated resource development, oil exploration And energy conservation through special tax concessions.",0,- introduced income equalisation deposits for Primary producers. - abolished previous income limits on the tax averaging Scheme for Primary producers.,Liberal,1980,Liberal,6
531,531,63620_198010_531,"Overall, we have created a fair, balanced tax system.",0,"- abolished previous income limits on the tax averaging Scheme for Primary producers. - stimulated resource development, oil exploration And energy conservation through special tax concessions.",Liberal,1980,Liberal,3
532,532,63620_198010_532,That is why we are taking a hard line on tax avoidance.,0,"- stimulated resource development, oil exploration And energy conservation through special tax concessions. Overall, we have created A fair, balanced tax system.",Liberal,1980,Liberal,1
533,533,63620_198010_533,We are committed to continuing our restraint on public expenditure and ensuring we get value for money so that we can continue to keep taxes down.,0,"Overall, we have created a fair, balanced tax system. That is why we are taking a hard line on tax avoidance.",Liberal,1980,Liberal,4
534,534,63620_198010_534,"Unlike Labor, we know that governments have no money of their own to spend only taxpayers' money.",1,That is why we are taking a hard line on tax avoidance. We are committed to continuing our restraint on public expenditure and ensuring we get value for money so that we can continue to keep taxes down.,Liberal,1980,Liberal,1
535,535,63620_198010_535,INDUSTRIAL RELATIONS.,1,"We are committed to continuing our restraint on public expenditure and ensuring we get value for money so that we can continue to keep taxes down. Unlike Labor, we know that governments have no money of their own to spend only taxpayers' money.",Liberal,1980,Liberal,1
536,536,63620_198010_536,The Government's principal objectives are to: - work to improve the industrial relations climate.,0,"Unlike Labor, we know that governments have no money of their own to spend only taxpayers' money. INDUSTRIAL RELATIONS.",Liberal,1980,Liberal,2
537,537,63620_198010_537,- protect the rights of individuals And the public interest.,0,INDUSTRIAL RELATIONS. The Government's principal objectives are to: - work to improve the industrial relations climate.,Liberal,1980,Liberal,3
538,538,63620_198010_538,- emphasise the responsibility of all parties to meet their obligations.,0,The Government's principal objectives are to: - work to improve the industrial relations climate. - protect the rights of individuals And the public interest.,Liberal,1980,Liberal,6
539,539,63620_198010_539,- improve conciliation And arbitration procedures.,0,- protect the rights of individuals And the public interest. - emphasise the responsibility of all parties to meet their obligations.,Liberal,1980,Liberal,1
540,540,63620_198010_540,The Government is concerned that almost four million working days were lost through industrial diputes last year.,1,- emphasise the responsibility of all parties to meet their obligations. - improve conciliation And arbitration procedures.,Liberal,1980,Liberal,1
541,541,63620_198010_541,This is an improvement on the record of over six million working days lost under the Labor Government in 1974.,1,- improve conciliation And arbitration procedures. the Government is concerned that almost four million working days were lost through industrial diputes Last year.,Liberal,1980,Liberal,1
542,542,63620_198010_542,"But the figure is still too high and far too costly for individual employers, employees and their families, and the community as a whole.",1,The Government is concerned that almost four million working days were lost through industrial diputes last year. This is an improvement on the record of over six million working days lost under the Labor Government in 1974.,Liberal,1980,Liberal,1
543,543,63620_198010_543,There are Constitutional limits on the Government's industrial relations powers.,1,"This is an improvement on the record of over six million working days lost under the Labor Government in 1974. But the figure is still too high and far too costly for individual employers, employees and their families, and the community as a whole.",Liberal,1980,Liberal,1
544,544,63620_198010_544,"Nevertheless, we have already acted within those powers to protect the public interest.",1,"But the figure is still too high and far too costly for individual employers, employees and their families, and the community as a whole. There are Constitutional limits on the Government's industrial relations powers.",Liberal,1980,Liberal,1
545,545,63620_198010_545,We have legislated to: - establish the National Labour Consultative Council and ensure regular consultation at national level.,1,"There are Constitutional limits on the Government's industrial relations powers. Nevertheless, we have already acted within those powers to protect the public interest.",Liberal,1980,Liberal,1
546,546,63620_198010_546,- provide secret postal ballots for elections in Federal employer And employee organisations.,1,"Nevertheless, we have already acted within those powers to protect the public interest. We have legislated to: - establish the National Labour Consultative Council and ensure regular consultation at national level.",Liberal,1980,Liberal,1
547,547,63620_198010_547,- require industrial organisations to produce audited annual financial accounts to members.,1,We have legislated to: - establish the National Labour Consultative Council and ensure regular consultation at national level. - provide secret postal ballots for elections in Federal employer And employee organisations.,Liberal,1980,Liberal,1
548,548,63620_198010_548,- protect genuine conscientious objectors to union membership.,1,- provide secret postal ballots for elections in Federal employer And employee organisations. - require industrial organisations to produce audited annual financial accounts to members.,Liberal,1980,Liberal,1
549,549,63620_198010_549,- improve the procedures of the conciliation And arbitration Commission.,1,- require industrial organisations to produce audited annual financial accounts to members. - protect genuine conscientious objectors to union membership.,Liberal,1980,Liberal,1
550,550,63620_198010_550,- extend grounds for deregistration of organisations acting to damage the interests of the community.,1,- protect genuine conscientious objectors to union membership. - improve the procedures of the conciliation And arbitration Commission.,Liberal,1980,Liberal,1
551,551,63620_198010_551,- strengthen the Commission's powers to deal with demarcation disputes.,1,- improve the procedures of the conciliation And arbitration Commission. - extend grounds for deregistration of organisations acting to damage the interests of the community.,Liberal,1980,Liberal,1
552,552,63620_198010_552,"- establish the industrial Relations Bureau to SECURE observance of the conciliation And arbitration Act, Regulations And Awards.",1,- extend grounds for deregistration of organisations acting to damage the interests of the community. - strengthen the Commission's powers to deal with demarcation disputes.,Liberal,1980,Liberal,1
553,553,63620_198010_553,The task is a continuing one.,1,"- strengthen the Commission's powers to deal with demarcation disputes. - establish the industrial Relations Bureau to secure observance of the conciliation And arbitration Act, Regulations And Awards.",Liberal,1980,Liberal,1
554,554,63620_198010_554,"For the future, the Government proposes to: - extend the secret ballot provisions to enable individual employees to apply for a secret ballot to express their views on strike action.",0,"- establish the industrial Relations Bureau to SECURE observance of the conciliation And arbitration Act, Regulations And Awards. the task is A continuing one.",Liberal,1980,Liberal,4
555,555,63620_198010_555,"- legislate to facilitate the amalgamation of unions where there is a ""community of interest"".",0,"The task is a continuing one. For the future, the Government proposes to: - extend the secret ballot provisions to enable individual employees to apply for a secret ballot to express their views on strike action.",Liberal,1980,Liberal,1
556,556,63620_198010_556,"- in consultation with Industry, initiate A major campaign of advice And assistance to all levels of management on the conduct And practice of industrial relations.",0,"For the future, the Government proposes to: - extend the secret ballot provisions to enable individual employees to apply for a secret ballot to express their views on strike action. - legislate to facilitate the amalgamation of unions where there is a ""community of interest"".",Liberal,1980,Liberal,1
557,557,63620_198010_557,The Government remains firmly committed to the principle of conciliation and arbitration.,0,"- legislate to facilitate the amalgamation of unions where there is a ""community of interest"". - in consultation with Industry, initiate A major campaign of advice And assistance to all levels of management on the conduct And practice of industrial relations.",Liberal,1980,Liberal,4
558,558,63620_198010_558,EMPLOYMENT.,1,"- in consultation with Industry, initiate A major campaign of advice And assistance to all levels of management on the conduct And practice of industrial relations. the Government remains firmly committed to the principle of conciliation And arbitration.",Liberal,1980,Liberal,1
559,559,63620_198010_559,We have made substantial progress in creating more jobs.,1,The Government remains firmly committed to the principle of conciliation and arbitration. EMPLOYMENT.,Liberal,1980,Liberal,1
560,560,63620_198010_560,"205,200 more people joined the work force in the year to August 1980.",1,EMPLOYMENT. We have made substantial progress in creating more jobs.,Liberal,1980,Liberal,1
561,561,63620_198010_561,"Unemployment is still high, but Australia is making better progress than many other developed countries.",1,"We have made substantial progress in creating more jobs. 205,200 more people joined the work force in the year to August 1980.",Liberal,1980,Liberal,1
562,562,63620_198010_562,Through the Commonwealth Employment Service alone half a million jobs were filled last year.,1,"205,200 more people joined the work force in the year to August 1980. Unemployment is still high, but Australia is making better progress than many other developed countries.",Liberal,1980,Liberal,1
563,563,63620_198010_563,Those placed included 9.000 disabled people.,1,"Unemployment is still high, but Australia is making better progress than many other developed countries. Through the Commonwealth Employment Service alone half a million jobs were filled last year.",Liberal,1980,Liberal,1
564,564,63620_198010_564,Three out of four jobs in Australia are in the private sector.,1,Through the Commonwealth Employment Service alone half a million jobs were filled last year. Those placed included 9.000 disabled people.,Liberal,1980,Liberal,1
565,565,63620_198010_565,That is why the Government is strongly committed to encouraging its growth.,0,Those placed included 9.000 disabled people. Three out of four jobs in Australia are in the private sector.,Liberal,1980,Liberal,1
566,566,63620_198010_566,"Over the next few years resource and manufacturing development projects will create at least 60,000 new jobs directly and thousands more indirectly throughout industry and commerce.",0,Three out of four jobs in Australia are in the private sector. That is why the Government is strongly committed to encouraging its growth.,Liberal,1980,Liberal,7
567,567,63620_198010_567,"In our five years in Government more than 570,000 Australians have received specific help through our manpower and training programmes.",0,"That is why the Government is strongly committed to encouraging its growth. Over the next few years resource and manufacturing development projects will create at least 60,000 new jobs directly and thousands more indirectly throughout industry and commerce.",Liberal,1980,Liberal,7
568,568,63620_198010_568,We have given special emphasis in these programmes to job and apprenticeship training for young people.,0,"Over the next few years resource and manufacturing development projects will create at least 60,000 new jobs directly and thousands more indirectly throughout industry and commerce. In our five years in Government more than 570,000 Australians have received specific help through our manpower and training programmes.",Liberal,1980,Liberal,1
569,569,63620_198010_569,"All our programmes have been reviewed to meet the challenge of technological change and the special needs of the nation's new development projects We will spend $139 million on manpower, training programmes and youth support to assist another 236,000 Australians this year.",0,"In our five years in Government more than 570,000 Australians have received specific help through our manpower and training programmes. We have given special emphasis in these programmes to job and apprenticeship training for young people.",Liberal,1980,Liberal,7
570,570,63620_198010_570,New features of job programmes will include reform of the trade training system to increase the supply of tradesmen trained in Australia.,0,"We have given special emphasis in these programmes to job and apprenticeship training for young people. All our programmes have been reviewed to meet the challenge of technological change and the special needs of the nation's new development projects We will spend $139 million on manpower, training programmes and youth support to assist another 236,000 Australians this year.",Liberal,1980,Liberal,1
571,571,63620_198010_571,"This will include shortened indentures for those with appropriate qualifications and experience and renewal of the $1,000 bonus scheme for apprentices in short supply.",0,"All our programmes have been reviewed to meet the challenge of technological change and the special needs of the nation's new development projects We will spend $139 million on manpower, training programmes and youth support to assist another 236,000 Australians this year. New features of job programmes will include reform of the trade training system to increase the supply of tradesmen trained in Australia.",Liberal,1980,Liberal,4
572,572,63620_198010_572,Australia is now training an all time high number of apprentices and a record level of first year apprentices.,1,"New features of job programmes will include reform of the trade training system to increase the supply of tradesmen trained in Australia. This will include shortened indentures for those with appropriate qualifications and experience and renewal of the $1,000 bonus scheme for apprentices in short supply.",Liberal,1980,Liberal,1
573,573,63620_198010_573,"To complement this scheme and the School-to-Work Transition Policy, the Government will also provide further assistance to young people who find difficulty in obtaining regular work.",0,"This will include shortened indentures for those with appropriate qualifications and experience and renewal of the $1,000 bonus scheme for apprentices in short supply. Australia is now training an all time high number of apprentices and a record level of first year apprentices.",Liberal,1980,Liberal,1
574,574,63620_198010_574,"This will provide for: - a transition allowance (unemployment benefit plus $6) for young people unemployed four months or more who undertake a transition course, and a similar allowance for those unemployed for eight months or more who take up any full time training course in Technical and Further Education (TAFE) institutions likely to lead to employment.",0,"Australia is now training an all time high number of apprentices and a record level of first year apprentices. To complement this scheme and the School-to-Work Transition Policy, the Government will also provide further assistance to young people who find difficulty in obtaining regular work.",Liberal,1980,Liberal,7
575,575,63620_198010_575,- a higher subsidy (up to $ 80 a week) for the training under the Special Youth Employment Training Programme (SYETP) of those unemployed 18 to 24 year olds who have been out of work for eight out of twelve months.,0,"To complement this scheme and the School-to-Work Transition Policy, the Government will also provide further assistance to young people who find difficulty in obtaining regular work. This will provide for: - a transition allowance (unemployment benefit plus $6) for young people unemployed four months or more who undertake a transition course, and a similar allowance for those unemployed for eight months or more who take up any full time training course in Technical and Further Education (TAFE) institutions likely to lead to employment.",Liberal,1980,Liberal,7
576,576,63620_198010_576,- automatic eligibility to SYETP for those who successfully complete A Transition course And need further on-the-job training.,0,"This will provide for: - a transition allowance (unemployment benefit plus $6) for young people unemployed four months or more who undertake a transition course, and a similar allowance for those unemployed for eight months or more who take up any full time training course in Technical and Further Education (TAFE) institutions likely to lead to employment. - a higher subsidy (up to $ 80 a week) for the training under the Special Youth Employment Training Programme (SYETP) of those unemployed 18 to 24 year olds who have been out of work for eight out of twelve months.",Liberal,1980,Liberal,1
