,oid,Id,sentence,Flag,context,party,year,incumbent,labels
778,778,63620_198010_778,The family is the focus of Australian life.,1,POLICIES FOR PEOPLE. THE FAMILY.,Liberal,1980,Liberal,1
779,779,63620_198010_779,"That is why the Government is extending its social security and welfare policies for families, especially those most in need.",0,THE FAMILY. The family is the focus of Australian life.,Liberal,1980,Liberal,1
780,780,63620_198010_780,These policies also cover sole parents and disabled people of all ages.,0,"The family is the focus of Australian life. That is why the Government is extending its social security and welfare policies for families, especially those most in need.",Liberal,1980,Liberal,1
781,781,63620_198010_781,"The assistance for these groups is identified in the Government's education, housing, health, social security and other welfare programmes.",0,"That is why the Government is extending its social security and welfare policies for families, especially those most in need. These policies also cover sole parents and disabled people of all ages.",Liberal,1980,Liberal,3
782,782,63620_198010_782,"The Commonwealth shares the responsibility for these programmes, with State and Territory Governments.",1,"These policies also cover sole parents and disabled people of all ages. The assistance for these groups is identified in the Government's education, housing, health, social security and other welfare programmes.",Liberal,1980,Liberal,1
783,783,63620_198010_783,The financial commitment is large and this year the Government has allocated increased funds to ensure that the real level of these services is maintained.,1,"The assistance for these groups is identified in the Government's education, housing, health, social security and other welfare programmes. The Commonwealth shares the responsibility for these programmes, with State and Territory Governments.",Liberal,1980,Liberal,1
784,784,63620_198010_784,EDUCATION.,1,"The Commonwealth shares the responsibility for these programmes, with State and Territory Governments. The financial commitment is large and this year the Government has allocated increased funds to ensure that the real level of these services is maintained.",Liberal,1980,Liberal,1
785,785,63620_198010_785,"The Government will spend $2,867 million on education in 1980/81.",1,The financial commitment is large and this year the Government has allocated increased funds to ensure that the real level of these services is maintained. EDUCATION.,Liberal,1980,Liberal,1
786,786,63620_198010_786,Its objectives in education are to: - promote freedom of choice and equality of opportunity in schooling.,1,"EDUCATION. The Government will spend $2,867 million on education in 1980/81.",Liberal,1980,Liberal,1
787,787,63620_198010_787,- achieve standards of excellence at all levels.,1,"The Government will spend $2,867 million on education in 1980/81. Its objectives in education are to: - promote freedom of choice and equality of opportunity in schooling.",Liberal,1980,Liberal,1
788,788,63620_198010_788,- help the disadvantaged in the community.,1,Its objectives in education are to: - promote freedom of choice and equality of opportunity in schooling. - achieve standards of excellence at all levels.,Liberal,1980,Liberal,1
789,789,63620_198010_789,The Government will direct more of its resources to vocational and technical education.,1,- achieve standards of excellence at all levels. - help the disadvantaged in the community.,Liberal,1980,Liberal,1
790,790,63620_198010_790,Its priority is to provide more help for students to make the transition from school to work.,1,- help the disadvantaged in the community. the Government will direct more of its Resources to vocational And technical education.,Liberal,1980,Liberal,1
791,791,63620_198010_791,The Commonwealth reaffirms its commitment to provide $150 million over five years for the School-to-Work Transition programme.,0,The Government will direct more of its resources to vocational and technical education. Its priority is to provide more help for students to make the transition from school to work.,Liberal,1980,Liberal,7
792,792,63620_198010_792,"The Commonwealth meets virtually the entire cost of Universities and Colleges of Advanced Education, approximately $1,280 million a year.",0,Its priority is to provide more help for students to make the transition from school to work. The Commonwealth reaffirms its commitment to provide $150 million over five years for the School-to-Work Transition programme.,Liberal,1980,Liberal,1
793,793,63620_198010_793,The Government reintroduced triennium funding arrangements for these institutions in 1979 and this provides them with a greater capacity for forward planning.,1,"The Commonwealth reaffirms its commitment to provide $150 million over five years for the School-to-Work Transition programme. The Commonwealth meets virtually the entire cost of Universities and Colleges of Advanced Education, approximately $1,280 million a year.",Liberal,1980,Liberal,1
794,794,63620_198010_794,Grants to the States for Government schools in 1981 will be maintained at the same real levels as in 1980.,0,"The Commonwealth meets virtually the entire cost of Universities and Colleges of Advanced Education, approximately $1,280 million a year. The Government reintroduced triennium funding arrangements for these institutions in 1979 and this provides them with a greater capacity for forward planning.",Liberal,1980,Liberal,4
795,795,63620_198010_795,Declining school enrolments mean this is an effective increase in expenditure on a per student basis by the Commonwealth.,1,The Government reintroduced triennium funding arrangements for these institutions in 1979 and this provides them with a greater capacity for forward planning. Grants to the States for Government schools in 1981 will be maintained at the same real levels as in 1980.,Liberal,1980,Liberal,1
796,796,63620_198010_796,The government will maintain its policy of @ grants to non-government schools.,0,Grants to the States for Government schools in 1981 will be maintained at the same real levels as in 1980. Declining school enrolments mean this is an effective increase in expenditure on a per student basis by the Commonwealth.,Liberal,1980,Liberal,4
797,797,63620_198010_797,@ movements in the average cost of educating a student in a government school.,0,Declining school enrolments mean this is an effective increase in expenditure on a per student basis by the Commonwealth. The government will maintain its policy of @ grants to non-government schools.,Liberal,1980,Liberal,1
798,798,63620_198010_798,The programmes of aid for disadvantaged schools and disadvantaged country areas will be continued.,0,The government will maintain its policy of @ grants to non-government schools. @ movements in the average cost of educating a student in a government school.,Liberal,1980,Liberal,4
799,799,63620_198010_799,"These programmes have helped 400,000 students in 1350 schools throughout Australia this year.",1,@ movements in the average cost of educating a student in a government school. The programmes of aid for disadvantaged schools and disadvantaged country areas will be continued.,Liberal,1980,Liberal,1
800,800,63620_198010_800,Special provision has also been made to - assist Aboriginal children in their schooling.,0,"The programmes of aid for disadvantaged schools and disadvantaged country areas will be continued. These programmes have helped 400,000 students in 1350 schools throughout Australia this year.",Liberal,1980,Liberal,1
801,801,63620_198010_801,- provide multicultural Education And help non-English speaking migrant children improve their English language skills.,0,"These programmes have helped 400,000 students in 1350 schools throughout Australia this year. Special provision has also been made to - assist Aboriginal children in their schooling.",Liberal,1980,Liberal,3
802,802,63620_198010_802,- assist refugee And handicapped children.,0,Special provision has also been made to - assist Aboriginal children in their schooling. - provide multicultural Education And help non-English speaking migrant Children improve their English language skills.,Liberal,1980,Liberal,3
803,803,63620_198010_803,New Commitments.,1,- provide multicultural Education And help non-English speaking migrant children improve their English language skills. - assist refugee And handicapped children.,Liberal,1980,Liberal,1
804,804,63620_198010_804,New commitments include: - an increase in the per capita grant to Level 6 non-government schools to 40% of average government schools standard running costs during the life of the next Parliament.,0,- assist refugee And handicapped children. new Commitments.,Liberal,1980,Liberal,7
805,805,63620_198010_805,- compression of the existing six levels of non-Government schools (as defined by the schools Commission) to three levels in the life of the next Parliament.,0,New Commitments. New commitments include: - an increase in the per capita grant to Level 6 non-government schools to 40% of average government schools standard running costs during the life of the next Parliament.,Liberal,1980,Liberal,1
806,806,63620_198010_806,"- additional capital grants of $ 25 million over three years, 1981-83, for new places in non-government schools.",0,New commitments include: - an increase in the per capita grant to Level 6 non-government schools to 40% of average government schools standard running costs during the life of the next Parliament. - compression of the existing six levels of non-Government schools (as defined by the schools Commission) to three levels in the life of the next Parliament.,Liberal,1980,Liberal,7
807,807,63620_198010_807,- a special allocation of $2 million a year from 1981 to develop education programmes for severely handicapped children.,0,"- compression of the existing six levels of non-Government schools (as defined by the schools Commission) to three levels in the life of the next Parliament. - additional capital grants of $ 25 million over three years, 1981-83, for new places in non-government schools.",Liberal,1980,Liberal,7
808,808,63620_198010_808,"- a per capita grant of $ 30 a year for two years to non-profit, part-time ethnic schools providing supplementary community language and cultural programmes.",0,"- additional capital grants of $ 25 million over three years, 1981-83, for new places in non-government schools. - a special allocation of $2 million a year from 1981 to develop education programmes for severely handicapped children.",Liberal,1980,Liberal,7
809,809,63620_198010_809,- funds to establish new courses in community languages in universities And/or colleges of advanced education.,0,"- a special allocation of $2 million a year from 1981 to develop education programmes for severely handicapped children. - a per capita grant of $ 30 a year for two years to non-profit, part-time ethnic schools providing supplementary community language and cultural programmes.",Liberal,1980,Liberal,6
810,810,63620_198010_810,- funds for the establishment of Research Centres of Excellence in a number of universities at a cost of $ 1 million in 1981 and a further $ 15 million during the 1982-84 triennium.,0,"- a per capita grant of $ 30 a year for two years to non-profit, part-time ethnic schools providing supplementary community language and cultural programmes. - funds to establish new courses in community languages in universities And/or colleges of advanced education.",Liberal,1980,Liberal,7
811,811,63620_198010_811,"- A three year pilot programme to provide on loan video facilities for Isolated students in remote areas, beginning with students of the School of the Air.",0,- funds to establish new courses in community languages in universities And/or colleges of advanced education. - funds for the establishment of Research Centres of Excellence in a number of universities at a cost of $ 1 million in 1981 and a further $ 15 million during the 1982-84 triennium.,Liberal,1980,Liberal,3
812,812,63620_198010_812,"- for those who qualify, an increase in 1981 to $ 780 a year for the basic boarding allowance under the Assistance to Isolated Children Scheme.",0,"- funds for the establishment of Research Centres of Excellence in a number of universities at a cost of $ 1 million in 1981 and a further $ 15 million during the 1982-84 triennium. - A three year pilot programme to provide on loan video facilities for Isolated students in remote areas, beginning with students of the School of the Air.",Liberal,1980,Liberal,7
813,813,63620_198010_813,HOUSING.,1,"- A three year pilot programme to provide on loan video facilities for Isolated students in remote areas, beginning with students of the School of the Air. - for those who qualify, an increase in 1981 to $ 780 a year for the basic boarding allowance under the Assistance to Isolated Children Scheme.",Liberal,1980,Liberal,1
814,814,63620_198010_814,"Today, 73% of Australians own or are purchasing their homes The Government strongly supports home ownership and will continue to give a high priority to the availability of housing finance.",1,"- for those who qualify, an increase in 1981 to $ 780 a year for the basic boarding allowance under the Assistance to Isolated Children Scheme. HOUSING.",Liberal,1980,Liberal,1
815,815,63620_198010_815,Over a million home seekers have been helped to get housing loans in the last five years.,1,"HOUSING. Today, 73% of Australians own or are purchasing their homes The Government strongly supports home ownership and will continue to give a high priority to the availability of housing finance.",Liberal,1980,Liberal,1
816,816,63620_198010_816,Housing loan approvals were at a record level last year.,1,"Today, 73% of Australians own or are purchasing their homes The Government strongly supports home ownership and will continue to give a high priority to the availability of housing finance. Over a million home seekers have been helped to get housing loans in the last five years.",Liberal,1980,Liberal,1
817,817,63620_198010_817,Home Savings Grants.,1,Over a million home seekers have been helped to get housing loans in the last five years. Housing loan approvals were at a record level last year.,Liberal,1980,Liberal,1
818,818,63620_198010_818,The Government has progressively developed the Home Savings Grants Scheme to assist first home buyers.,1,Housing loan approvals were at a record level last year. Home Savings Grants.,Liberal,1980,Liberal,1
819,819,63620_198010_819,"We will now go further and: - provide from 1 October 1980 a new Home Savings Grant Family Bonus of $ 500 for families with one dependent child and $1,000 for families with two or more dependent children.",0,Home Savings Grants. The Government has progressively developed the Home Savings Grants Scheme to assist first home buyers.,Liberal,1980,Liberal,7
820,820,63620_198010_820,"The respective maximum grants, therefore, will increase to $2,500 and $3,000.",0,"The Government has progressively developed the Home Savings Grants Scheme to assist first home buyers. We will now go further and: - provide from 1 October 1980 a new Home Savings Grant Family Bonus of $ 500 for families with one dependent child and $1,000 for families with two or more dependent children.",Liberal,1980,Liberal,7
821,821,63620_198010_821,"- increase the value limit for which a maximum grant is payable to $60,000, reducing to nil at $70,000.",0,"We will now go further and: - provide from 1 October 1980 a new Home Savings Grant Family Bonus of $ 500 for families with one dependent child and $1,000 for families with two or more dependent children. The respective maximum grants, therefore, will increase to $2,500 and $3,000.",Liberal,1980,Liberal,7
822,822,63620_198010_822,- widen the form of acceptable savings.,0,"The respective maximum grants, therefore, will increase to $2,500 and $3,000. - increase the value limit for which a maximum grant is payable to $60,000, reducing to nil at $70,000.",Liberal,1980,Liberal,3
823,823,63620_198010_823,- allow full tax deductibility of home insulation costs for a person's first home where that home was purchased or where construction commenced after 1 October this year.,0,"- increase the value limit for which a maximum grant is payable to $60,000, reducing to nil at $70,000. - widen the form of acceptable savings.",Liberal,1980,Liberal,5
824,824,63620_198010_824,Funding for welfare housing was increased in the last Budget.,1,- widen the form of acceptable savings. - allow full tax deductibility of home insulation costs for a person's first home where that home was purchased or where construction commenced after 1 October this year.,Liberal,1980,Liberal,1
825,825,63620_198010_825,The Commonwealth/State Housing Agreement has been changed to give low and moderate income earners increased opportunities to own their own homes.,1,- allow full tax deductibility of home insulation costs for a person's first home where that home was purchased or where construction commenced after 1 October this year. Funding for welfare housing was increased in the last Budget.,Liberal,1980,Liberal,1
826,826,63620_198010_826,The Government has announced a major forward commitment for welfare housing with the States.,1,Funding for welfare housing was increased in the last Budget. The Commonwealth/State Housing Agreement has been changed to give low and moderate income earners increased opportunities to own their own homes.,Liberal,1980,Liberal,1
827,827,63620_198010_827,"This provides a guarantee by the Commonwealth of a base funding level of $200 million a year for five years from July 1981, with specific arrangements for concessional interest rates and grants for rental housing assistance, interest subsidies and leasing.",1,The Commonwealth/State Housing Agreement has been changed to give low and moderate income earners increased opportunities to own their own homes. The Government has announced a major forward commitment for welfare housing with the States.,Liberal,1980,Liberal,1
828,828,63620_198010_828,HEALTH.,1,"The Government has announced a major forward commitment for welfare housing with the States. This provides a guarantee by the Commonwealth of a base funding level of $200 million a year for five years from July 1981, with specific arrangements for concessional interest rates and grants for rental housing assistance, interest subsidies and leasing.",Liberal,1980,Liberal,1
829,829,63620_198010_829,The Government is determined that all Australians should have access to high quality health care.,1,"This provides a guarantee by the Commonwealth of a base funding level of $200 million a year for five years from July 1981, with specific arrangements for concessional interest rates and grants for rental housing assistance, interest subsidies and leasing. HEALTH.",Liberal,1980,Liberal,1
830,830,63620_198010_830,It recognises the important part the private hospitals have in our health services.,1,HEALTH. The Government is determined that all Australians should have access to high quality health care.,Liberal,1980,Liberal,1
831,831,63620_198010_831,"It is totally committed to ensuring the viability and preservation of private hospitals, especially the non-profit component.",1,The Government is determined that all Australians should have access to high quality health care. It recognises the important part the private hospitals have in our health services.,Liberal,1980,Liberal,1
832,832,63620_198010_832,We established the first ever inquiry into Australia's hospitals seeking recommendations on how waste could be reduced and efficiency increased.,1,"It recognises the important part the private hospitals have in our health services. It is totally committed to ensuring the viability and preservation of private hospitals, especially the non-profit component.",Liberal,1980,Liberal,1
833,833,63620_198010_833,The Inquiry's report will be considered as a matter of urgency.,1,"It is totally committed to ensuring the viability and preservation of private hospitals, especially the non-profit component. We established the first ever inquiry into Australia's hospitals seeking recommendations on how waste could be reduced and efficiency increased.",Liberal,1980,Liberal,1
834,834,63620_198010_834,The provision of health services involves substantial cost and this needs to be contained within a responsible economic policy.,1,We established the first ever inquiry into Australia's hospitals seeking recommendations on how waste could be reduced and efficiency increased. The Inquiry's report will be considered as a matter of urgency.,Liberal,1980,Liberal,1
835,835,63620_198010_835,"This year the total is over $3,000 million.",1,The Inquiry's report will be considered as a matter of urgency. The provision of health services involves substantial cost and this needs to be contained within a responsible economic policy.,Liberal,1980,Liberal,1
836,836,63620_198010_836,"We have increased assistance to help the aged, chronically ill and disadvantaged.",1,"The provision of health services involves substantial cost and this needs to be contained within a responsible economic policy. This year the total is over $3,000 million.",Liberal,1980,Liberal,1
837,837,63620_198010_837,"In line with a previous commitment, benefits will be increased from the first pension pay day in November to cover the cost of fees for 70% of patients in nongovernment nursing homes.",0,"This year the total is over $3,000 million. We have increased assistance to help the aged, chronically ill and disadvantaged.",Liberal,1980,Liberal,7
838,838,63620_198010_838,The Government this year has increased its financial support for medical research by 30% and has decided to: - fund on a $ for $ basis with the Victorian Government a new building for the Walter and Eliza Hall Institute of Medical Research at an estimated cost to the Commonwealth of $ 11.25 million.,1,"We have increased assistance to help the aged, chronically ill and disadvantaged. In line with a previous commitment, benefits will be increased from the first pension pay day in November to cover the cost of fees for 70% of patients in nongovernment nursing homes.",Liberal,1980,Liberal,1
839,839,63620_198010_839,- significantly increase funds for alcohol And drug rehabilitation programmes.,1,"In line with a previous commitment, benefits will be increased from the first pension pay day in November to cover the cost of fees for 70% of patients in nongovernment nursing homes. The Government this year has increased its financial support for medical research by 30% and has decided to: - fund on a $ for $ basis with the Victorian Government a new building for the Walter and Eliza Hall Institute of Medical Research at an estimated cost to the Commonwealth of $ 11.25 million.",Liberal,1980,Liberal,1
840,840,63620_198010_840,"In addition, more funds will be allocated to continuing the national development of the ""Help Yourself"" health promotion campaign.",1,The Government this year has increased its financial support for medical research by 30% and has decided to: - fund on a $ for $ basis with the Victorian Government a new building for the Walter and Eliza Hall Institute of Medical Research at an estimated cost to the Commonwealth of $ 11.25 million. - significantly increase funds for alcohol And drug rehabilitation programmes.,Liberal,1980,Liberal,1
841,841,63620_198010_841,SOCIAL SECURITY AND WELFARE.,1,"- significantly increase funds for alcohol And drug rehabilitation programmes. In addition, more funds will be allocated to continuing the national development of the ""Help Yourself"" health promotion campaign.",Liberal,1980,Liberal,1
842,842,63620_198010_842,"Historically, many of the major advances in social security and welfare have been introduced by Liberal Governments.",1,"In addition, more funds will be allocated to continuing the national development of the ""Help Yourself"" health promotion campaign. SOCIAL SECURITY AND WELFARE.",Liberal,1980,Liberal,1
843,843,63620_198010_843,"In the past five years, the Government has directed more resources to assist the aged, the disabled and other disadvantaged groups than any previous government since Federation.",1,"SOCIAL SECURITY AND WELFARE. Historically, many of the major advances in social security and welfare have been introduced by Liberal Governments.",Liberal,1980,Liberal,1
844,844,63620_198010_844,Total spending on social security and welfare expenditure has risen from $5 billion in 1975/76 to almost $10 billion in 1980/81.,1,"Historically, many of the major advances in social security and welfare have been introduced by Liberal Governments. In the past five years, the Government has directed more resources to assist the aged, the disabled and other disadvantaged groups than any previous government since Federation.",Liberal,1980,Liberal,1
845,845,63620_198010_845,Major reforms have included: - replacement of the means test on pensions by a simple income test and introduction of automatic indexation of pensions.,1,"In the past five years, the Government has directed more resources to assist the aged, the disabled and other disadvantaged groups than any previous government since Federation. Total spending on social security and welfare expenditure has risen from $5 billion in 1975/76 to almost $10 billion in 1980/81.",Liberal,1980,Liberal,1
846,846,63620_198010_846,- cash assistance direct to mothers under the Family allowance Scheme.,1,Total spending on social security and welfare expenditure has risen from $5 billion in 1975/76 to almost $10 billion in 1980/81. Major reforms have included: - replacement of the means test on pensions by a simple income test and introduction of automatic indexation of pensions.,Liberal,1980,Liberal,1
